,text,Category
0,"Delete Facebook, hit the streets  https://t.co/eiqaMmNiaJ",Pro-choice
1,@Razzaque_Ayesha This was indeed one of the few good things that Trump was able to pull off.  He made sure that the… https://t.co/WUxzIBu2jI,Pro-life
2,For context this happened when I told multiple people who cheered the Roe VS Wade decision to shut the fuck up.,Pro-choice
3,I’m not arguing with anyone about roe v wade. You’re dumb if you don’t understand how important this is.,Pro-choice
4,we been on this! when the issues happened in Texas well before this was overturned - Apple committed to their emplo… https://t.co/o87xjA1lVn,Pro-choice
5,"@dindin6 @kylegriffin1 Roe v Wade was terrible law, it should have ALWAYS been a states issue, and now it is. As us… https://t.co/Do7oWuvkzn",Pro-life
6,annoyed i can’t voice my opinion on roe v wade in my house bc my mom is anti choice,Pro-choice
7,@alexismcgill Roe v Wade is no longer. Wonderful!,Pro-life
8,out here wondering if the supreme court realizes how much they’ve fucked up yet. because the shitstorm they created… https://t.co/8fsK0j1aTK,Pro-choice
9,"More telling: How the Justices see themselves impacted by ending Roe v Wade: They get paid BIG money. Concerning, n… https://t.co/hiUPidSq9w",Pro-choice
10,@CjPsychosis @MrColionNoir Certain peoples in the U.S. have led people to believe that pre-born babies don't matter… https://t.co/vifp8Nk8IZ,Pro-life
11,"@websurvivor @davidhogg111 The way Justice Ginsburg saw it, Roe v. Wade was focused on the wrong argument.. restric… https://t.co/G4mucFuCsG",Pro-choice
12,@ewarren https://t.co/S2VAwXI9n8,Pro-choice
13,Well if reversing roe v Wade is to preserve white babies. Then reversing loving v Va is to preserve the white race https://t.co/dkXzgkFnp5,Pro-choice
14,And to EVERYONE celebrating the overturning of Roe v Wade. You better pray you don’t have a miscarriage. And pray y… https://t.co/qIF2Nqfp8D,Pro-choice
15,"Supreme Court overturned Roe v. Wade

What. Ta. Hell?!
🤬🤬🤬🔪🔪🔪",Pro-choice
16,"Well, just had an argument with my mom about everything going on in our country. From the Supreme Court to Roe v Wa… https://t.co/AYKobguxRJ",Pro-choice
17,the worst decision I’ve made in a minute is visiting home the day after roe v wade is overturned bc why is my 12 ye… https://t.co/VHW5sIwc1m,Pro-choice
18,"With Roe v. Wade overturned, the #Canadian public needs to know where @CPC_HQ stands on abortion rights. Add your n… https://t.co/2mIUf0NdDO",Pro-choice
19,"@DrDebraSoh Oh naff off

 Trans hostile people cosying up to conservative Christians against trans folk instead of… https://t.co/ctHZVvR8ft",Pro-choice
20,I Am very disappointed that the court over turned the case of roe v wade and that they didn’t keep certain pertecti… https://t.co/7QJwcBu1E1,Pro-choice
21,"cause to benefit those that have no way of refusing her imposition. 
#ElVioladorEresTú! 

""come November, 86 state… https://t.co/TQfsVipkH4",Pro-choice
22,"good morning, the supreme court overturning roe v wade is literally unconstitutional",Pro-choice
23,CNMA is grieving with millions of you today at the loss of our constitutionally recognized right to abortion with t… https://t.co/Ej1nw5JfnS,Pro-choice
24,@bingus_the_cat_ @Timcast There is NO Constitutional guarantee for abortion or any other form of murder !!!!! Roe v… https://t.co/4F8FLLMhem,Pro-life
25,"Most Americans favor keeping Roe v Wade.

But the unaccountable sponsors of #TeamCoup have cheated and bought their… https://t.co/6ZE81vRGJL",Pro-choice
26,"If you think that the supreme court overturning Roe vs Wade is a good thing and you are celebrating, never speak to me again!!👍",Pro-choice
27,"Excited to share this item from my #etsy shop: No Country for Old Men Shirt, Pro Choice Shirt, Ruth Bader Ginsburg… https://t.co/mst5EHPK6n",Pro-choice
28,@ChrisMurphyCT Why didn't you demand Roe v Wade be made law?,Pro-choice
29,"It's so obvious that anti-abortion chuds strive to make people's lives worse, since Roe v Wade never took options a… https://t.co/sypo4FnItr",Pro-choice
30,Roe v. Wade has just been overturned – and abortion rights activists from across the world are fighting back. Join… https://t.co/Bu6LWMrsXb,Pro-choice
31,Another thing that pisses me off about everything going on is y’all thought one election was it. Fam. Republicans h… https://t.co/2kNGXmCBc3,Pro-choice
32,"@McFaul Protector of the free world, but sadly it doesn't belong to.

And not only because of Roe v Wade.",Pro-choice
33,Opinion | The incredible hypocrisy of Christian 'religious freedom' rhetoric after Roe https://t.co/Izrnc3SdBk via @msnbc,Pro-choice
34,"@Duckypam @SenatorWarnock Then think about this:
Two known sex offenders overturned Roe vs. Wade. Let that sink in.",Pro-choice
35,Roe v. Wade is Gone. We Must Demand the U.S. Congress Pass Protections for Reproductive Rights Now! https://t.co/HrJoJ8o6O0,Pro-choice
36,"anyone who supports the overturned roe v wade is absolute disgrace to the Constitution

you know damn well you don’… https://t.co/76pb3ovnat",Pro-choice
37,China having abortion doesn’t magically make them better than us like the camps and other human rights violations d… https://t.co/UE9xpOKyEu,Pro-choice
38,"The people calling for folks to be civil in their abortion discourse are how we got here.

No.

My body. Piss off.",Pro-choice
39,63 percent of the American population supports Roe V Wade (the majority)! While 5 justices voted to overturn Roe! U… https://t.co/BfvzyWVft8,Pro-choice
40,"@SMBWhitney @BarackObama Its funny you bring up Ginsberg, she stated many times Roe vs Wade was bad law.",Pro-life
41,"@bluekat323 @leighmatsell @caambers @Robthefrosty @Sparkle31888597 The ""domestic terrorism"" is happening RIGHT NOW… https://t.co/THft1peY8s",Pro-life
42,How you gonna let sex offenders overturn Roe v Wade? #SCOTUS,Pro-choice
43,There’s about to be a lotion shortage. The flip side of overturning Roe v. Wade is now women will not have sex with… https://t.co/4QuF1h7l7Y,Pro-choice
44,The US Supreme Court washed their hands off the abortion issue like Pontius Pilate and gave States the responsibili… https://t.co/raWfjP0lO3,Pro-choice
45,The folks who are ecstatic about Roe v Wade being overturned have been oddly quiet about Ukrainian babies/children… https://t.co/3E042nr9og,Pro-choice
46,"Roe v. Wade shows the importance of voting and why you should never ""sit this one out"". People said there's no diff… https://t.co/eJ9ehMSsyW",Pro-choice
47,"As other states ban abortion, CT gears up for an influx of patients. Because in CT Women Matter!! https://t.co/coe44N17Ir",Pro-choice
48,"@baseball99 @BarackObama The reason Roe V Wade was struck down is that these justices believe, religiously, that th… https://t.co/TdXMex9OiL",Pro-choice
49,@POTUS Abortion is murder,Pro-life
50,We just repealed Roe v. Wade and my Senator is posting on main about wanting to bring back segregation. https://t.co/v25E0dl6eX,Pro-choice
51,"@JustOneVoice68 @V1s1D @Gatros27 @darugona_ ""Overturning Roe v. Wade could have implications for more than access t… https://t.co/wankiSJ97G",Pro-choice
52,@LilTeamkimlisa @GavinNewsom It isn't a law. Abortion is not a constitutional right,Pro-life
53,@SueZieCue So you should still be against Roe v. Wade because clearly there’s nothing in the constitution to suppor… https://t.co/eNIJPb30e6,Pro-choice
54,if people think that women are angry about roe v wade because they want to “kill babies”…. crack open a fucking book,Pro-choice
55,@POTUS A constitutional amendment to put roe vs Wade into the Constitution. All we need is 2/3 of the Senate and 2/… https://t.co/2HXdMqWve4,Pro-choice
56,Democrats have reneged on their longtime promise to codify Roe v. Wade every time they’ve held power. Party leaders… https://t.co/fNyO6X7rwt,Pro-choice
57,I had a miserable pregnancy and I would seriously rather risk death than ever be pregnant again. I love my child en… https://t.co/V3GZKr2mD9,Pro-choice
58,"@djrothkopf In addition to the overturning of #Roe v Wade, do you mean a President (#Trump) saying to his Departmen… https://t.co/oqmNhYhH7l",Pro-choice
59,@eire175 @idyllchatter @go_figureitout @kylegriffin1 Politicians on both sides don't work for the people..they work… https://t.co/bHCUOz6quI,Pro-life
60,@SpeakerPelosi taking advantage to ask for fundraising money + my vote to fix the Roe v Wade mess. I already voted… https://t.co/W3lXj5OaOn,Pro-choice
61,@Lindaloverlips @Strandjunker @TheJohnDiMaggio No one is “for abortion.” Those who support Roe v. Wade believe a wo… https://t.co/T6haPc0Juk,Pro-choice
62,@LiberalsTDS2020 @JoJoFromJerz You’re also a perfect example of why they should never have overturned Roe vs Wade.,Pro-choice
63,"@Christo36805226 @JillFilipovic Speaking of ignorance, did you even bother checking out the other state's rulings?… https://t.co/dDE6K62tFf",Pro-choice
64,"@amyklobuchar Wouldn't birth control be easier &amp; even cheaper? Oh yeah, you're complicit in using abortion as a for… https://t.co/QLNxFk1UMV",Pro-life
65,"Quick reminder... Obumer put Roe v Wade on the back burner in 2009, pretty much the way the Dems have done since 74.",Pro-choice
66,"Hey ladies in favor of roe v wade. I just want you to put into perspective, if you were raped by any man, and he ca… https://t.co/9w8Q7qSKQ3",Pro-choice
67,"Thank you ⁦@JayInslee⁩, ⁦@GavinNewsom⁩, ⁦@OregonGovBrown⁩

Next steps for Washington, Oregon, California after Roe… https://t.co/wDdzzKpOlp",Pro-choice
68,@OttawaCitizen @CBCOttawa @drakefenton @Marco_Vigliotti @_MarkSutcliffe @JimWatsonOttawa @JonathanWilling if u took… https://t.co/50YmlyzUwt,Pro-choice
69,@thatoneguy_jm It's like no one reads that 70% of people were in favor of Roe v Wade and wanted it codified. You're… https://t.co/G6dXyWpwwg,Pro-choice
70,I hope someday people will understand what roe v wade oveturned actually does. Strong support for the overturned ruling,Pro-life
71,"@____sassycassie @AdamRintala I feel your pain Cassie, having lived in the  pre Roe v. Wade era, it’s a major step… https://t.co/u1rELjQJvj",Pro-choice
72,"Vancouver Pro-Choice Rally Tomorrow
https://t.co/hwgNEvk1CR

Stand in rage &amp; solidarity with our siblings across th… https://t.co/K4LARZk59m",Pro-choice
73,"@charliekirk11 Your ""God"" has killed more babies than abortion has",Pro-choice
74,I’m not surprised at the old wrinkled saggy balls having a$$ men who voted to overturn Roe vs Wade but Justice Amy… https://t.co/9eGRfqcSLp,Pro-choice
75,him. You think this is something? You think this is bad? This? This chicanery? He's done worse. Roe v Wade! Are you… https://t.co/NhUpetB7DW,Pro-choice
76,"@DavidAFrench Yeaaaaah, didn’t they also say that Roe v Wade was settled law and precedent? So we should trust them… https://t.co/lPxyLMov0a",Pro-choice
77,OMG as if the LBGTQXyzabcdsd  can’t spew enough BS already there new mantra now since Roe V Wade was turned back ri… https://t.co/cbzJNOzesy,Pro-life
78,"I’ve been too shocked and too angry at the Roe Vs Wade ruling to even know where to start and what to say

This lad… https://t.co/J6poxhTF9l",Pro-choice
79,"A person is pregnant. They are not prepared to raise a child, go through the adoption process, or otherwise just ha… https://t.co/XwUXPOz6qw",Pro-choice
80,"Women should not have to tell their bosses they are pregnant and need abortion travel money.

This is insane.",Pro-choice
81,"This decision will create the possibility of protecting human life from conception
　→この決定により、受胎から人間の生命を守る可能性が生まれます… https://t.co/aMLSN14c09",Pro-life
82,"To be frank, I don’t want to hear outrage about the overturning of Roe v. Wade, or about mass shootings and Congres… https://t.co/UlFWeKt7xl",Pro-choice
83,If you complain about your tax dollars going to welfare but also support the turning over of Roe V Wade then oh boy… https://t.co/vqlIKPQb4d,Pro-choice
84,The decision to overturn Roe v. Wade is a devastating attack on women's rights. The UK government cannot remain sil… https://t.co/xDn6vScreI,Pro-choice
85,@Ultii400 @ParmesanPinot @That_Haifisch @RicoSuaveJD @Pappiness Thank you for Trump! Thank you for fascism! Thank y… https://t.co/w515aRMBFZ,Pro-life
86,"@ZambranaML @GovWhitmer Yet, legal abortion procedures actually increased maternal mortality rates in the US by dou… https://t.co/qMLABx7KZW",Pro-life
87,Roe v. Wade has just been overturned – and abortion rights activists from across the world are fighting back. Join… https://t.co/U1B3RgGyGK,Pro-choice
88,"Hi

I'm a gay trans man

I can actually still get pregnant

Roe v Wade affects us, too, Winnie

Please for the love… https://t.co/MHF4qeOwif",Pro-choice
89,You can’t argue with these statistics! And you STILL want to bring children into this world?! SICK! Overturn the ov… https://t.co/HoBtCmnX0M,Pro-choice
90,Global Health Promise stands in solidarity with all folks whose reproductive rights are compromised by the overturn… https://t.co/vTlwYM0in1,Pro-choice
91,@nathaliejacoby1 Start phrasing this as the Right to Privacy. This is going to have far reaching ramifications than… https://t.co/pEAFzkTa2i,Pro-choice
92,"Protests in Chicago. Hang in there USA. Canada, don't get complacent. CON MPs eyeing overturning Roe v Wade as a ho… https://t.co/nvuMRVJri4",Pro-choice
93,"If you're a priest or a bishop and you have publicly praised the overturning of Roe vs Wade, thank you.",Pro-life
94,Abortion care is health care. https://t.co/PxiX3t5S4Z,Pro-choice
95,@roronoa_zoro007 Yeah it's upto the individual state has no business in restricting. Of course until 24 weeks becau… https://t.co/nBdD7PiBKx,Pro-choice
96,Men don’t need to get a vasectomy to be a woman’s ally. You can help women by protesting what’s going on with Roe v… https://t.co/totEOExT0w,Pro-choice
97,"@zychj @newsmax What made Roe vs Wade law of the land back then? Would you say, ""the opinions of Supreme Court justices""?",Pro-life
98,"@jedediahsays @or1ngi @LVJYLESBlAN @HaroldDiazRodr1 @chbupdates Nah I literaly just said that these example, for ex… https://t.co/sjomD9tyiA",Pro-choice
99,Hey just a thought: if you celebrated roe v. wade being overturned yesterday but you are not actively working towar… https://t.co/Bp83wlJjH3,Pro-choice
100,"Now that SCOTUS has overturned Roe v. Wade &amp; Miranda Rights, looks like the only right that’s safe is to have a tot… https://t.co/OyoaMt2CDo",Pro-choice
101,"If you’re a cis hetro man and feel like you’re not allowed to have an opinion on abortion, then on some level you k… https://t.co/ucJA1c2DxP",Pro-choice
102,Would be OK if it were seven extremists forcing their personal and religious views on the rest of us? Roe v Wade wa… https://t.co/80NBBy9EjF,Pro-life
103,The decision to overturn Roe v. Wade is a devastating attack on women's rights. The UK government cannot remain sil… https://t.co/lgAmzf2KLq,Pro-choice
104,I try to stay away from all things political but if you’re fucking pro life and happy about the roe v wade you can… https://t.co/DoFrbk4OoM,Pro-choice
105,@4HollyF @itsJeffTiedrich We live in New York State. If either of our adult daughters ever needed ton have an abort… https://t.co/VuVPrcWbZO,Pro-choice
106,"“Why are you trying to fight the roe v wade decision so much?”
Because it’s human rights. Not just for me, but for… https://t.co/w8qv5367z6",Pro-choice
107,"@Leerose1985 Wow if this is how they are reacting to Roe V. Wade being overturned … 

Wait until the midterms, this… https://t.co/lAtWHd4jKa",Pro-life
108,@theliamnissan I was watching Amanpour on PBS and her guest said that Repubs have been working on reversing Roe v W… https://t.co/xPL6ZO5Pq9,Pro-choice
109,@NickPye10 Accidents happen.  Not everyone who gets an abortion is irresponsible.,Pro-choice
110,"Yes.  This Boomer has voted Democrat in every election, other than for mayor in a city I no longer live in.  I have… https://t.co/XL0xrnS9cd",Pro-choice
111,@duchessofdis @jabooka13 But what the right is doing to humanity &amp; democracy is so much more than just abortion - t… https://t.co/mzFg4pm0ez,Pro-choice
112,i had an abortion at 19. i didn’t tell my abusive boyfriend. i’m now 22 and no longer with him. if i had CHOSEN to… https://t.co/Tkmf9VXXrg,Pro-choice
113,Asking what my company is doing to help women who need access to the appropriate healthcare regarding yesterday’s R… https://t.co/rduaqr9MjQ,Pro-choice
114,"@frankcorder @S51781902 @Apple @DICKS I have a prediction. 
About the time the same women come to them for travel e… https://t.co/GtayrlIkms",Pro-life
115,The late actor's 23-year-old daughter is just one of many women to speak out about yesterday's decision. https://t.co/x1pdB2pvyK,Pro-choice
116,"No, Trump, God Didn't Overturn Roe v. Wade || By Ed Kilgore https://t.co/1FABXw51ws",Pro-choice
117,Find it fascinating Trump appointed the justices who exposed Roe v Wade as the sham it was for fifty years and it h… https://t.co/nPNLVig4AX,Pro-life
118,"If you support the overturning of Roe v. Wade, kindly get off of my page. The right for those with uteruses to have… https://t.co/PVcyT7X67m",Pro-choice
119,"Wait, so SCOTUS overturning roe v wade is attacking women’s rights? I thought women couldn’t be defined by anatomy?… https://t.co/Ig2di8dEtt",Pro-life
120,"@DannieD01 Devastated, gutted, sad, disgusted! I’m 74 and lived through pre &amp; post Roe v Wade…and fought for rights… https://t.co/Be838965WR",Pro-choice
121,@libsoftiktok That's so worth it! Let's have a Roe V Wade announcement every few days!,Pro-life
122,@RehearsalLot @CRYPTONITEME @Reuters Here’s truth. Women are not going back. Period. We have records of abortion ba… https://t.co/GjrOLoJPZz,Pro-choice
123,Glastonbury artists hit out at Roe vs Wade overturning by Supreme Court https://t.co/YCcPBoSyWg,Pro-choice
124,"@jakob_eichhorn @ELINTNews They’re not openly defying anything. They follow federal laws, and there is no federal law banning abortion.",Pro-choice
125,there’s so many things i wanna say about roe v wade but i can’t even put anything into words because it angers me so much,Pro-choice
126,"@MayoIsSpicyy Have zero respect for any woman that does not vote on their state to repeal last scotus stay, as male… https://t.co/VJfYAdFoBG",Pro-choice
127,EVERYONE should be FURIOUS at the overturn of Roe vs Wade. EVERYONE SHOULD BE ANGRY.,Pro-choice
128,@bananagirl925 @ranaltboo abortion is not a political issue. it is simply about human decency. i agree that nobody… https://t.co/2f1434RkLp,Pro-choice
129,"@RelentlessYapp @ZaidJilani But it can give you a Dem governor to veto bad GOP-led state legislative laws, or pardo… https://t.co/gIWyUAh8Yh",Pro-choice
130,@dramadelinquent My take is abortion should be allowed only under circumstances that are traumatising as rape or if… https://t.co/e5IWtqb7hh,Pro-choice
131,Do you know that young ladies are doing it secretly and also getting away with it here while some die in the proces… https://t.co/GkLRqvpth8,Pro-choice
132,@BNNBreaking This push wanting to keep abortion says more about what they are not saying now,Pro-life
133,Disney was nothing but a Façade.  We’re seeing their true selves.  They stand against parents rights and now stand… https://t.co/N3V8F1PR8N,Pro-life
134,"Just heard about Roe V Wade 😔 that’s messed up (I’m single, well dressed, and have a vasectomy btw)",Pro-choice
135,https://t.co/2vL1gxc3P3,Pro-choice
136,"Trust God, President Joe Biden, trust Abba! The judges that voted to overturn Roe vs Wade, were obeying the voice o… https://t.co/9ArHovcy7f",Pro-life
137,This Supreme Court overturning Roe v. Wade have now shown their preference for the version of the Constitution and… https://t.co/8MKZ3bQ7TM,Pro-choice
138,"@mtracey No, they ban abortion on demand. In practice you can still get an abortion pretty easily into the 2nd trim… https://t.co/4odUuFeNd9",Pro-choice
139,@ErikNervik @fawlty @Timcast There you go. All the headers (even though you won’t comprehend it). You’re wrong here… https://t.co/hH1PKxCOF9,Pro-choice
140,okay ik that i often don’t get political on this acc but with the recent events (roe v wade). i’m genuine scared fo… https://t.co/OJVw9I9VgR,Pro-choice
141,"@carlycross_ Are you really this lost? Roe vs Wade was bad law doesn't matter if it stood for 50 years, Same as Ple… https://t.co/0aq8CcTG8R",Pro-choice
142,@JoJoFromJerz True. I'm thinking that we could help this travesty by : you know how you can pre-psy for a cup of co… https://t.co/s7IEckGvLu,Pro-choice
143,@ericswalwell The only reason abortion rights were so low on public voting priority lists was because the public ha… https://t.co/oDxttDFwzY,Pro-choice
144,Love the Roe V Wade  decision. Now maybe all you abortionist will move back to your home state and let Texas respect and enjoy life.,Pro-life
145,@ananavarro would rid the world of special needs kids by using late term abortions and post birth abortions!!!… https://t.co/cV619omGlm,Pro-life
146,"@PerlmanJanine @AshleiKing Lolol so glad somebody finally fact checked me! But you know what, it worked cause @cnn… https://t.co/3tQn0NgkKT",Pro-choice
147,When a woman gets an abortion she is showered with love by so many and called “brave” but when a dude doesn’t want… https://t.co/nSfliSBqac,Pro-life
148,@CathyPe63220996 @BeverleeMascio2 @RonnyJacksonTX The difference is literally that the baby was born. The fetus in… https://t.co/jqtBpAOub5,Pro-choice
149,Still think Trump was the best president?  3 of these people in the majority were appointed by Trump. All of them s… https://t.co/Vnu0BBwt2V,Pro-choice
150,"@B52Malmet @Hefner_Online This will void the HIPPA laws. 
HIPPA was based on Roe v. Wade
America is NOT FREE",Pro-choice
151,Obama once said it was his #1 priority. Joe Biden promised to codify Roe v Wade as a campaign promise. Why haven't… https://t.co/5oBoLGKB7S,Pro-choice
152,every male comedian today is starting their set with “so roe v wade got overturned :/ bummer :/“ like go rot please,Pro-choice
153,call me dramatic but I have absolutely no interest in going to arizona right now(or any fucking state restricting a… https://t.co/iLRif9RKZP,Pro-choice
154,"This Roe vs. Wade news is completely messed up. I don't have anything clever to say about it. It's just wrong, and I'm livid.",Pro-choice
155,"Roe v Wade overturning WILL kill people.

People will murder people that they accidentally got pregnant. 

People w… https://t.co/HoxwNIcBHo",Pro-choice
156,"People can no longer afford to LIVE, a woman could get r—ped and would be JAILED if she got an abortion, we’re faci… https://t.co/4nNJqKSa2P",Pro-choice
157,"@Kevin5740Arnold @wildflower2101 @selenagomez We are paying for the abortion. And, if we let everyone do their own… https://t.co/qfxGV7a5pu",Pro-life
158,"@AerisFelidae You're right and I should definitely make more of an effort there
I think Roe vs Wade has just been s… https://t.co/cXaA2VNL9j",Pro-choice
159,@byron_nichols @BNNBreaking @patagonia Stay in your own religious lane and get out of mine with your swill. My reli… https://t.co/FNZEFbeRbo,Pro-choice
160,Roe v. Wade has just been overturned – and abortion rights activists from across the world are fighting back. Join… https://t.co/JxTO2IRJEC,Pro-choice
161,@lennysperson @boudicca_iceni @TheAmandaGorman My point was that no one should be told what to do with their bodies… https://t.co/wqNUcm2t1q,Pro-choice
162,"@colinstone To all the young women out down south, educate yourself about human reproductive system, how it works,… https://t.co/NCwRJfAt8e",Pro-life
163,@rachelkayw @ClaudetteGGibs1 Minnesota…everyone always seems to forget Minnesota.  Add it to the the list as it’s l… https://t.co/UesVPyyzRr,Pro-choice
164,"@michaelmalice They need more minions. China has 1.4 bi and incentives 3 kids per family now... So, no abortion in… https://t.co/yxkktzBIl4",Pro-choice
165,@TomFitton @BarackObama How many decades of precedence preceded the unconstitutional ruling for Roe vs Wade?,Pro-life
166,"@Robbyboy_4life @Reddrik @EitoDorito @markiplier Same argument that civil war apologists give about ""state rights""… https://t.co/x8JHM0d7ar",Pro-choice
167,If you're a woman complaining about this roe v Wade decision. And you voted Republican for Trump in 2016 then this is your fault.,Pro-choice
168,"Republicans made the last mistake they will ever make in any position of federal authority ever again.

We are goin… https://t.co/w7JVnQ1TeB",Pro-choice
169,going around saying women should close their legs as if men have ever shown MORE self restraint ever in history ove… https://t.co/nn9rOdYOt1,Pro-choice
170,"@loooolooo @shitemanes @christo56849068 @TyTheFisch who decides if it is appropriate legal route?
Again, with this… https://t.co/Z76qCuPbDr",Pro-choice
171,I know that it's a scary time rn but I'm begging yall to check local news sources before saying a state doesnt have… https://t.co/zqPQlat2eu,Pro-choice
172,@TimG90730962 @nonyabi88117386 @username198653 @ckh82003 @Cyderisdead @MostlyPeacefull @GovWhitmer You only have th… https://t.co/9JBOPSE5OU,Pro-choice
173,"We live in a world where the man can abandon the mother of his child. AND then they make abortions illegal!
Basical… https://t.co/LgF6UsNDst",Pro-choice
174,"@thunderrosa22 You know birth control exists... right? Moral of the story is ""MAKE BETTER VAGINAL DECISIONS and YOU… https://t.co/YM7YQv6fgK",Pro-life
175,@RinainDC @SenatorBigBird So what are you going to do to ensure that Roe vs Wade is codified as law?,Pro-choice
176,"if you are in any way pro-choice or believe that roe v wade being overturned is a bad thing, my work is not for you… https://t.co/x85CpBMqp4",Pro-life
